Game of Thrones,Drama,Um monte gente brigando pra ver quem vai ser Rei,2011,16,HBO MAX,8,73
The Office,Comedia,Mostra a rotina de um escritorio,2005,14,HBO MAX,9,201
Dark,Suspense,Conta os podres de uma cidade depois de umas crianças sumirem,2017,18,Netflix,2,6
Deuses Americanos,Aventura,Confusao e fofoca no mundo divino,2017,14,Prime Video,3,26
Black Summer,Terror,Apocalipse Zumbi,2019,16,Netflix,2,16
Loki,Acao,Serie do Deus mais lindo da Marvel,2021,14,Disney,1,6
Jardim de Meteoros,Romance,Uma doida vai parar na Coreia do Norte e se apaixona por um soldado,2019,16,Netflix,1,16